2018-10-29 07:21:27.169818 IP 127.0.0.1.44224 > 127.0.0.1.65200: tcp 0
2018-10-29 07:21:27.169907 IP 127.0.0.1.65200 > 127.0.0.1.44224: tcp 0
2018-10-29 07:21:27.169929 IP 127.0.0.1.44224 > 127.0.0.1.65200: tcp 0
2018-10-29 07:21:27.170103 IP 127.0.0.1.44224 > 127.0.0.1.65200: tcp 106
2018-10-29 07:21:27.170112 IP 127.0.0.1.65200 > 127.0.0.1.44224: tcp 0
2018-10-29 07:21:27.183386 IP 127.0.0.1.65200 > 127.0.0.1.44224: tcp 50
2018-10-29 07:21:27.183396 IP 127.0.0.1.44224 > 127.0.0.1.65200: tcp 0
2018-10-29 07:21:27.186893 IP 127.0.0.1.44224 > 127.0.0.1.65200: tcp 0
2018-10-29 07:21:27.188631 IP 127.0.0.1.65200 > 127.0.0.1.44224: tcp 0
2018-10-29 07:21:27.188648 IP 127.0.0.1.44224 > 127.0.0.1.65200: tcp 0
2018-10-29 07:21:27.688840 IP 127.0.0.1.44238 > 127.0.0.1.65200: tcp 0
2018-10-29 07:21:27.688870 IP 127.0.0.1.65200 > 127.0.0.1.44238: tcp 0
2018-10-29 07:21:27.688888 IP 127.0.0.1.44238 > 127.0.0.1.65200: tcp 0
2018-10-29 07:21:27.688939 IP 127.0.0.1.44238 > 127.0.0.1.65200: tcp 106
2018-10-29 07:21:27.688946 IP 127.0.0.1.65200 > 127.0.0.1.44238: tcp 0
2018-10-29 07:21:27.703114 IP 127.0.0.1.65200 > 127.0.0.1.44238: tcp 50
2018-10-29 07:21:27.703126 IP 127.0.0.1.44238 > 127.0.0.1.65200: tcp 0
2018-10-29 07:21:27.703596 IP 127.0.0.1.44238 > 127.0.0.1.65200: tcp 0
2018-10-29 07:21:27.704623 IP 127.0.0.1.65200 > 127.0.0.1.44238: tcp 0
2018-10-29 07:21:27.704639 IP 127.0.0.1.44238 > 127.0.0.1.65200: tcp 0
2018-10-29 07:21:28.205416 IP 127.0.0.1.44252 > 127.0.0.1.65200: tcp 0
2018-10-29 07:21:28.205434 IP 127.0.0.1.65200 > 127.0.0.1.44252: tcp 0
2018-10-29 07:21:28.205451 IP 127.0.0.1.44252 > 127.0.0.1.65200: tcp 0
2018-10-29 07:21:28.205513 IP 127.0.0.1.44252 > 127.0.0.1.65200: tcp 106
2018-10-29 07:21:28.205520 IP 127.0.0.1.65200 > 127.0.0.1.44252: tcp 0
2018-10-29 07:21:28.205988 IP 127.0.0.1.65200 > 127.0.0.1.44252: tcp 3
2018-10-29 07:21:28.205998 IP 127.0.0.1.44252 > 127.0.0.1.65200: tcp 0
2018-10-29 07:21:28.206223 IP 127.0.0.1.44252 > 127.0.0.1.65200: tcp 0
2018-10-29 07:21:28.206380 IP 127.0.0.1.65200 > 127.0.0.1.44252: tcp 0
2018-10-29 07:21:28.206392 IP 127.0.0.1.44252 > 127.0.0.1.65200: tcp 0
2018-10-29 07:21:28.707513 IP 127.0.0.1.44262 > 127.0.0.1.65200: tcp 0
2018-10-29 07:21:28.707531 IP 127.0.0.1.65200 > 127.0.0.1.44262: tcp 0
2018-10-29 07:21:28.707549 IP 127.0.0.1.44262 > 127.0.0.1.65200: tcp 0
2018-10-29 07:21:28.707708 IP 127.0.0.1.44262 > 127.0.0.1.65200: tcp 55
2018-10-29 07:21:28.707745 IP 127.0.0.1.65200 > 127.0.0.1.44262: tcp 0
2018-10-29 07:21:28.708329 IP 127.0.0.1.65200 > 127.0.0.1.44262: tcp 50
2018-10-29 07:21:28.708339 IP 127.0.0.1.44262 > 127.0.0.1.65200: tcp 0
2018-10-29 07:21:28.708575 IP 127.0.0.1.44262 > 127.0.0.1.65200: tcp 0
2018-10-29 07:21:28.708736 IP 127.0.0.1.65200 > 127.0.0.1.44262: tcp 0
2018-10-29 07:21:28.708750 IP 127.0.0.1.44262 > 127.0.0.1.65200: tcp 0
2018-10-29 07:21:29.209753 IP 127.0.0.1.44264 > 127.0.0.1.65200: tcp 0
2018-10-29 07:21:29.209770 IP 127.0.0.1.65200 > 127.0.0.1.44264: tcp 0
2018-10-29 07:21:29.209787 IP 127.0.0.1.44264 > 127.0.0.1.65200: tcp 0
2018-10-29 07:21:29.209832 IP 127.0.0.1.44264 > 127.0.0.1.65200: tcp 55
2018-10-29 07:21:29.209839 IP 127.0.0.1.65200 > 127.0.0.1.44264: tcp 0
2018-10-29 07:21:29.213225 IP 127.0.0.1.65200 > 127.0.0.1.44264: tcp 50
2018-10-29 07:21:29.213239 IP 127.0.0.1.44264 > 127.0.0.1.65200: tcp 0
2018-10-29 07:21:29.213642 IP 127.0.0.1.44264 > 127.0.0.1.65200: tcp 0
2018-10-29 07:21:29.214068 IP 127.0.0.1.65200 > 127.0.0.1.44264: tcp 0
2018-10-29 07:21:29.214108 IP 127.0.0.1.44264 > 127.0.0.1.65200: tcp 0
2018-10-29 07:21:29.714585 IP 127.0.0.1.44274 > 127.0.0.1.65200: tcp 0
2018-10-29 07:21:29.714603 IP 127.0.0.1.65200 > 127.0.0.1.44274: tcp 0
2018-10-29 07:21:29.714620 IP 127.0.0.1.44274 > 127.0.0.1.65200: tcp 0
2018-10-29 07:21:29.714666 IP 127.0.0.1.44274 > 127.0.0.1.65200: tcp 106
2018-10-29 07:21:29.714672 IP 127.0.0.1.65200 > 127.0.0.1.44274: tcp 0
2018-10-29 07:21:29.715233 IP 127.0.0.1.65200 > 127.0.0.1.44274: tcp 3
2018-10-29 07:21:29.715244 IP 127.0.0.1.44274 > 127.0.0.1.65200: tcp 0
2018-10-29 07:21:29.715529 IP 127.0.0.1.44274 > 127.0.0.1.65200: tcp 0
2018-10-29 07:21:29.715665 IP 127.0.0.1.65200 > 127.0.0.1.44274: tcp 0
2018-10-29 07:21:29.715677 IP 127.0.0.1.44274 > 127.0.0.1.65200: tcp 0
2018-10-29 07:21:30.216929 IP 127.0.0.1.44276 > 127.0.0.1.65200: tcp 0
2018-10-29 07:21:30.216947 IP 127.0.0.1.65200 > 127.0.0.1.44276: tcp 0
2018-10-29 07:21:30.216964 IP 127.0.0.1.44276 > 127.0.0.1.65200: tcp 0
2018-10-29 07:21:30.217011 IP 127.0.0.1.44276 > 127.0.0.1.65200: tcp 106
2018-10-29 07:21:30.217018 IP 127.0.0.1.65200 > 127.0.0.1.44276: tcp 0
2018-10-29 07:21:30.217569 IP 127.0.0.1.65200 > 127.0.0.1.44276: tcp 3
2018-10-29 07:21:30.217580 IP 127.0.0.1.44276 > 127.0.0.1.65200: tcp 0
2018-10-29 07:21:30.217800 IP 127.0.0.1.44276 > 127.0.0.1.65200: tcp 0
2018-10-29 07:21:30.217896 IP 127.0.0.1.65200 > 127.0.0.1.44276: tcp 0
2018-10-29 07:21:30.217909 IP 127.0.0.1.44276 > 127.0.0.1.65200: tcp 0
2018-10-29 07:21:30.719776 IP 127.0.0.1.44278 > 127.0.0.1.65200: tcp 0
2018-10-29 07:21:30.719899 IP 127.0.0.1.65200 > 127.0.0.1.44278: tcp 0
2018-10-29 07:21:30.719927 IP 127.0.0.1.44278 > 127.0.0.1.65200: tcp 0
2018-10-29 07:21:30.719999 IP 127.0.0.1.44278 > 127.0.0.1.65200: tcp 106
2018-10-29 07:21:30.720010 IP 127.0.0.1.65200 > 127.0.0.1.44278: tcp 0
2018-10-29 07:21:30.720753 IP 127.0.0.1.65200 > 127.0.0.1.44278: tcp 3
2018-10-29 07:21:30.720762 IP 127.0.0.1.44278 > 127.0.0.1.65200: tcp 0
2018-10-29 07:21:30.720914 IP 127.0.0.1.44278 > 127.0.0.1.65200: tcp 0
2018-10-29 07:21:30.721047 IP 127.0.0.1.65200 > 127.0.0.1.44278: tcp 0
2018-10-29 07:21:30.721060 IP 127.0.0.1.44278 > 127.0.0.1.65200: tcp 0
2018-10-29 07:21:31.222022 IP 127.0.0.1.44280 > 127.0.0.1.65200: tcp 0
2018-10-29 07:21:31.222051 IP 127.0.0.1.65200 > 127.0.0.1.44280: tcp 0
2018-10-29 07:21:31.222070 IP 127.0.0.1.44280 > 127.0.0.1.65200: tcp 0
2018-10-29 07:21:31.222120 IP 127.0.0.1.44280 > 127.0.0.1.65200: tcp 55
2018-10-29 07:21:31.222127 IP 127.0.0.1.65200 > 127.0.0.1.44280: tcp 0
2018-10-29 07:21:31.222708 IP 127.0.0.1.65200 > 127.0.0.1.44280: tcp 50
2018-10-29 07:21:31.222719 IP 127.0.0.1.44280 > 127.0.0.1.65200: tcp 0
2018-10-29 07:21:31.222883 IP 127.0.0.1.44280 > 127.0.0.1.65200: tcp 0
2018-10-29 07:21:31.222983 IP 127.0.0.1.65200 > 127.0.0.1.44280: tcp 0
2018-10-29 07:21:31.222995 IP 127.0.0.1.44280 > 127.0.0.1.65200: tcp 0
2018-10-29 07:21:31.723848 IP 127.0.0.1.44282 > 127.0.0.1.65200: tcp 0
2018-10-29 07:21:31.723867 IP 127.0.0.1.65200 > 127.0.0.1.44282: tcp 0
2018-10-29 07:21:31.723885 IP 127.0.0.1.44282 > 127.0.0.1.65200: tcp 0
2018-10-29 07:21:31.723933 IP 127.0.0.1.44282 > 127.0.0.1.65200: tcp 106
2018-10-29 07:21:31.723940 IP 127.0.0.1.65200 > 127.0.0.1.44282: tcp 0
2018-10-29 07:21:31.724650 IP 127.0.0.1.65200 > 127.0.0.1.44282: tcp 3
2018-10-29 07:21:31.724661 IP 127.0.0.1.44282 > 127.0.0.1.65200: tcp 0
2018-10-29 07:21:31.724850 IP 127.0.0.1.44282 > 127.0.0.1.65200: tcp 0
2018-10-29 07:21:31.724949 IP 127.0.0.1.65200 > 127.0.0.1.44282: tcp 0
2018-10-29 07:21:31.724959 IP 127.0.0.1.44282 > 127.0.0.1.65200: tcp 0
2018-10-29 07:21:32.225991 IP 127.0.0.1.44284 > 127.0.0.1.65200: tcp 0
2018-10-29 07:21:32.226020 IP 127.0.0.1.65200 > 127.0.0.1.44284: tcp 0
2018-10-29 07:21:32.226033 IP 127.0.0.1.44284 > 127.0.0.1.65200: tcp 0
2018-10-29 07:21:32.226069 IP 127.0.0.1.44284 > 127.0.0.1.65200: tcp 106
2018-10-29 07:21:32.226072 IP 127.0.0.1.65200 > 127.0.0.1.44284: tcp 0
2018-10-29 07:21:32.226404 IP 127.0.0.1.65200 > 127.0.0.1.44284: tcp 3
2018-10-29 07:21:32.226409 IP 127.0.0.1.44284 > 127.0.0.1.65200: tcp 0
2018-10-29 07:21:32.226480 IP 127.0.0.1.44284 > 127.0.0.1.65200: tcp 0
2018-10-29 07:21:32.226526 IP 127.0.0.1.65200 > 127.0.0.1.44284: tcp 0
2018-10-29 07:21:32.226531 IP 127.0.0.1.44284 > 127.0.0.1.65200: tcp 0
2018-10-29 07:21:32.727526 IP 127.0.0.1.44286 > 127.0.0.1.65200: tcp 0
2018-10-29 07:21:32.727546 IP 127.0.0.1.65200 > 127.0.0.1.44286: tcp 0
2018-10-29 07:21:32.727565 IP 127.0.0.1.44286 > 127.0.0.1.65200: tcp 0
2018-10-29 07:21:32.727624 IP 127.0.0.1.44286 > 127.0.0.1.65200: tcp 106
2018-10-29 07:21:32.727631 IP 127.0.0.1.65200 > 127.0.0.1.44286: tcp 0
2018-10-29 07:21:32.728338 IP 127.0.0.1.65200 > 127.0.0.1.44286: tcp 3
2018-10-29 07:21:32.728350 IP 127.0.0.1.44286 > 127.0.0.1.65200: tcp 0
2018-10-29 07:21:32.728534 IP 127.0.0.1.44286 > 127.0.0.1.65200: tcp 0
2018-10-29 07:21:32.728684 IP 127.0.0.1.65200 > 127.0.0.1.44286: tcp 0
2018-10-29 07:21:32.728704 IP 127.0.0.1.44286 > 127.0.0.1.65200: tcp 0
2018-10-29 07:21:33.229793 IP 127.0.0.1.44288 > 127.0.0.1.65200: tcp 0
2018-10-29 07:21:33.229812 IP 127.0.0.1.65200 > 127.0.0.1.44288: tcp 0
2018-10-29 07:21:33.229830 IP 127.0.0.1.44288 > 127.0.0.1.65200: tcp 0
2018-10-29 07:21:33.229877 IP 127.0.0.1.44288 > 127.0.0.1.65200: tcp 106
2018-10-29 07:21:33.229885 IP 127.0.0.1.65200 > 127.0.0.1.44288: tcp 0
2018-10-29 07:21:33.230492 IP 127.0.0.1.65200 > 127.0.0.1.44288: tcp 3
2018-10-29 07:21:33.230503 IP 127.0.0.1.44288 > 127.0.0.1.65200: tcp 0
2018-10-29 07:21:33.230704 IP 127.0.0.1.44288 > 127.0.0.1.65200: tcp 0
2018-10-29 07:21:33.230856 IP 127.0.0.1.65200 > 127.0.0.1.44288: tcp 0
2018-10-29 07:21:33.230869 IP 127.0.0.1.44288 > 127.0.0.1.65200: tcp 0
2018-10-29 07:21:33.732299 IP 127.0.0.1.44290 > 127.0.0.1.65200: tcp 0
2018-10-29 07:21:33.732312 IP 127.0.0.1.65200 > 127.0.0.1.44290: tcp 0
2018-10-29 07:21:33.732324 IP 127.0.0.1.44290 > 127.0.0.1.65200: tcp 0
2018-10-29 07:21:33.732380 IP 127.0.0.1.44290 > 127.0.0.1.65200: tcp 106
2018-10-29 07:21:33.732386 IP 127.0.0.1.65200 > 127.0.0.1.44290: tcp 0
2018-10-29 07:21:33.732755 IP 127.0.0.1.65200 > 127.0.0.1.44290: tcp 3
2018-10-29 07:21:33.732763 IP 127.0.0.1.44290 > 127.0.0.1.65200: tcp 0
2018-10-29 07:21:33.732856 IP 127.0.0.1.44290 > 127.0.0.1.65200: tcp 0
2018-10-29 07:21:33.732925 IP 127.0.0.1.65200 > 127.0.0.1.44290: tcp 0
2018-10-29 07:21:33.732931 IP 127.0.0.1.44290 > 127.0.0.1.65200: tcp 0
2018-10-29 07:21:34.234435 IP 127.0.0.1.44292 > 127.0.0.1.65200: tcp 0
2018-10-29 07:21:34.234453 IP 127.0.0.1.65200 > 127.0.0.1.44292: tcp 0
2018-10-29 07:21:34.234471 IP 127.0.0.1.44292 > 127.0.0.1.65200: tcp 0
2018-10-29 07:21:34.234517 IP 127.0.0.1.44292 > 127.0.0.1.65200: tcp 106
2018-10-29 07:21:34.234524 IP 127.0.0.1.65200 > 127.0.0.1.44292: tcp 0
2018-10-29 07:21:34.235030 IP 127.0.0.1.65200 > 127.0.0.1.44292: tcp 3
2018-10-29 07:21:34.235040 IP 127.0.0.1.44292 > 127.0.0.1.65200: tcp 0
2018-10-29 07:21:34.235290 IP 127.0.0.1.44292 > 127.0.0.1.65200: tcp 0
2018-10-29 07:21:34.235379 IP 127.0.0.1.65200 > 127.0.0.1.44292: tcp 0
2018-10-29 07:21:34.235390 IP 127.0.0.1.44292 > 127.0.0.1.65200: tcp 0
2018-10-29 07:21:34.736610 IP 127.0.0.1.44294 > 127.0.0.1.65200: tcp 0
2018-10-29 07:21:34.736628 IP 127.0.0.1.65200 > 127.0.0.1.44294: tcp 0
2018-10-29 07:21:34.736646 IP 127.0.0.1.44294 > 127.0.0.1.65200: tcp 0
2018-10-29 07:21:34.736692 IP 127.0.0.1.44294 > 127.0.0.1.65200: tcp 106
2018-10-29 07:21:34.736699 IP 127.0.0.1.65200 > 127.0.0.1.44294: tcp 0
2018-10-29 07:21:34.737276 IP 127.0.0.1.65200 > 127.0.0.1.44294: tcp 3
2018-10-29 07:21:34.737287 IP 127.0.0.1.44294 > 127.0.0.1.65200: tcp 0
2018-10-29 07:21:34.737509 IP 127.0.0.1.44294 > 127.0.0.1.65200: tcp 0
2018-10-29 07:21:34.737616 IP 127.0.0.1.65200 > 127.0.0.1.44294: tcp 0
2018-10-29 07:21:34.737628 IP 127.0.0.1.44294 > 127.0.0.1.65200: tcp 0
2018-10-29 07:21:35.239344 IP 127.0.0.1.44296 > 127.0.0.1.65200: tcp 0
2018-10-29 07:21:35.239362 IP 127.0.0.1.65200 > 127.0.0.1.44296: tcp 0
2018-10-29 07:21:35.239380 IP 127.0.0.1.44296 > 127.0.0.1.65200: tcp 0
2018-10-29 07:21:35.239429 IP 127.0.0.1.44296 > 127.0.0.1.65200: tcp 106
2018-10-29 07:21:35.239436 IP 127.0.0.1.65200 > 127.0.0.1.44296: tcp 0
2018-10-29 07:21:35.239897 IP 127.0.0.1.65200 > 127.0.0.1.44296: tcp 3
2018-10-29 07:21:35.239908 IP 127.0.0.1.44296 > 127.0.0.1.65200: tcp 0
2018-10-29 07:21:35.240149 IP 127.0.0.1.44296 > 127.0.0.1.65200: tcp 0
2018-10-29 07:21:35.240234 IP 127.0.0.1.65200 > 127.0.0.1.44296: tcp 0
2018-10-29 07:21:35.240245 IP 127.0.0.1.44296 > 127.0.0.1.65200: tcp 0
2018-10-29 07:21:35.742166 IP 127.0.0.1.44298 > 127.0.0.1.65200: tcp 0
2018-10-29 07:21:35.742185 IP 127.0.0.1.65200 > 127.0.0.1.44298: tcp 0
2018-10-29 07:21:35.742202 IP 127.0.0.1.44298 > 127.0.0.1.65200: tcp 0
2018-10-29 07:21:35.742250 IP 127.0.0.1.44298 > 127.0.0.1.65200: tcp 106
2018-10-29 07:21:35.742257 IP 127.0.0.1.65200 > 127.0.0.1.44298: tcp 0
2018-10-29 07:21:35.742797 IP 127.0.0.1.65200 > 127.0.0.1.44298: tcp 3
2018-10-29 07:21:35.742807 IP 127.0.0.1.44298 > 127.0.0.1.65200: tcp 0
2018-10-29 07:21:35.743058 IP 127.0.0.1.44298 > 127.0.0.1.65200: tcp 0
2018-10-29 07:21:35.743161 IP 127.0.0.1.65200 > 127.0.0.1.44298: tcp 0
2018-10-29 07:21:35.743173 IP 127.0.0.1.44298 > 127.0.0.1.65200: tcp 0
2018-10-29 07:21:36.244314 IP 127.0.0.1.44300 > 127.0.0.1.65200: tcp 0
2018-10-29 07:21:36.244333 IP 127.0.0.1.65200 > 127.0.0.1.44300: tcp 0
2018-10-29 07:21:36.244383 IP 127.0.0.1.44300 > 127.0.0.1.65200: tcp 0
2018-10-29 07:21:36.244441 IP 127.0.0.1.44300 > 127.0.0.1.65200: tcp 106
2018-10-29 07:21:36.244448 IP 127.0.0.1.65200 > 127.0.0.1.44300: tcp 0
2018-10-29 07:21:36.245008 IP 127.0.0.1.65200 > 127.0.0.1.44300: tcp 3
2018-10-29 07:21:36.245019 IP 127.0.0.1.44300 > 127.0.0.1.65200: tcp 0
2018-10-29 07:21:36.245230 IP 127.0.0.1.44300 > 127.0.0.1.65200: tcp 0
2018-10-29 07:21:36.245321 IP 127.0.0.1.65200 > 127.0.0.1.44300: tcp 0
2018-10-29 07:21:36.245332 IP 127.0.0.1.44300 > 127.0.0.1.65200: tcp 0
2018-10-29 07:21:36.746650 IP 127.0.0.1.44302 > 127.0.0.1.65200: tcp 0
2018-10-29 07:21:36.746668 IP 127.0.0.1.65200 > 127.0.0.1.44302: tcp 0
2018-10-29 07:21:36.746687 IP 127.0.0.1.44302 > 127.0.0.1.65200: tcp 0
2018-10-29 07:21:36.746738 IP 127.0.0.1.44302 > 127.0.0.1.65200: tcp 106
2018-10-29 07:21:36.746745 IP 127.0.0.1.65200 > 127.0.0.1.44302: tcp 0
2018-10-29 07:21:36.747295 IP 127.0.0.1.65200 > 127.0.0.1.44302: tcp 3
2018-10-29 07:21:36.747306 IP 127.0.0.1.44302 > 127.0.0.1.65200: tcp 0
2018-10-29 07:21:36.747489 IP 127.0.0.1.44302 > 127.0.0.1.65200: tcp 0
2018-10-29 07:21:36.747593 IP 127.0.0.1.65200 > 127.0.0.1.44302: tcp 0
2018-10-29 07:21:36.747605 IP 127.0.0.1.44302 > 127.0.0.1.65200: tcp 0
